<?xml version="1.0" encoding="UTF-8"?>
<list xmlns:xsi="http://www.w3.org/2001/XMLSchema-instance" xsi:noNamespaceSchemaLocation="../../xsd/spawns.xsd">
	<spawn name="FairySettlement" ai="DayNightSpawns">
		<group>
			<npc id="30370" x="215664" y="80870" z="824" heading="33960" respawnTime="60sec" /> <!-- Nerupa -->
			<npc id="32921" x="214508" y="79668" z="824" heading="14514" respawnTime="60sec" /> <!-- Fairy Citizen -->
			<npc id="33566" x="214341" y="79639" z="824" heading="7699" respawnTime="60sec" /> <!-- Hermuncus' Minion -->
			<npc id="32916" x="215136" y="80267" z="816" heading="2859" respawnTime="60sec" /> <!-- Large Wisp -->
			<npc id="32916" x="214813" y="80620" z="816" heading="42137" respawnTime="60sec" /> <!-- Large Wisp -->
			<npc id="32916" x="214881" y="80682" z="816" heading="31316" respawnTime="60sec" /> <!-- Large Wisp -->
			<npc id="32916" x="214666" y="80261" z="816" heading="23345" respawnTime="60sec" /> <!-- Large Wisp -->
			<npc id="32916" x="215129" y="80493" z="848" heading="49371" respawnTime="60sec" /> <!-- Large Wisp -->
			<npc id="32916" x="215040" y="80404" z="816" heading="22056" respawnTime="60sec" /> <!-- Large Wisp -->
			<npc id="32916" x="215148" y="80270" z="816" heading="55344" respawnTime="60sec" /> <!-- Large Wisp -->
			<npc id="32916" x="215116" y="80431" z="816" heading="9461" respawnTime="60sec" /> <!-- Large Wisp -->			
		</group>
	</spawn>
</list>